"ups","title","subreddit","url"
40948,"George Santos accused of flashing white power symbol during House speaker vote","politics","https://www.businessinsider.com/george-santos-white-power-symbol-speaker-vote-2023-1"
32175,"Marjorie Taylor Greene backs away from QAnon history saying she got ‘sucked into some things I’d seen on the internet’","politics","https://www.independent.co.uk/news/world/americas/us-politics/marjorie-taylor-greene-qanon-disavow-b2258260.html"
10520,"If the Supreme Court strikes down student-loan forgiveness, it could have 'startling implications,' Biden says — and set a strange legal precedent going forward","politics","https://www.businessinsider.com/supreme-court-student-loan-debt-forgiveness-mohela-precedent-2023-1"
9135,"IRS targeted poorest taxpayers while millionaires went mostly unscathed in 2022: report","politics","https://www.foxnews.com/politics/irs-targeted-poorest-taxpayers-millionaires-went-unscathed-2022-report"
8725,"The Iceberg of Ignorance","business","https://i.redd.it/pwyp937jmuaa1.jpg"
6771,"Boebert's backers urge her to 'tone down the nasty rhetoric'","politics","https://apnews.com/article/politics-united-states-government-lauren-boebert-colorado-548e31f15bcbd1929cfe25975c200421"
6624,"McCarthy Pledges Repeal of IRS Funding Meant to Target Wealthy Tax Cheats","politics","https://www.commondreams.org/news/kevin-mccarthy-irs"
4999,"Conservatives take aim at tenure for university professors","politics","https://apnews.com/article/politics-colleges-and-universities-florida-state-government-texas-education-4f0fe0c5c18ed227fabae3744e8ff51d"
4849,"Trump claims Capitol rioter Ashli Babbitt was shot by a ‘lunatic’ for ‘no reason’ | Remarks came on anniversary of January 6","politics","https://www.independent.co.uk/news/world/americas/us-politics/trump-ashli-babbitt-january-6-b2258224.html"
4444,"‘It’s going to be dirty’: Republicans gear up for attack on Hunter Biden","politics","https://www.theguardian.com/us-news/2023/jan/08/house-republicans-attack-hunter-biden"
4053,"Half the World’s Workforce Works Too Much or Too Little","Economics","https://www.bloomberg.com/news/articles/2023-01-06/half-the-world-s-workforce-works-too-much-or-too-little?srnd=premium"
3478,"GOP Rep. Scott Perry, subject of Jan. 6 probes, declines to recuse himself from looking into those investigations","politics","https://www.nbcnews.com/politics/congress/rep-scott-perry-subject-jan-6-probes-declines-recuse-looking-investiga-rcna64801"
3300,"Liz Cheney posts eerie Trump quote after McCarthy thanks former president","politics","https://www.newsweek.com/liz-cheney-posts-eerie-trump-quote-after-mccarthy-thanks-former-president-1772090"
2620,"Rep. Tim Burchett said colleague Rep. Mike Rogers is a 'redneck' who 'shouldn't be drinking' following House floor brawl","politics","https://www.businessinsider.com/rep-burchett-redneck-rep-rogers-drinking-house-brawl-2023-1"
2614,"Of Course Steve Bannon and January 6 Fans Are Cheering on the Brazilian Insurrection","politics","https://www.motherjones.com/politics/2023/01/of-course-steve-bannon-and-january-6-fans-are-cheering-on-the-brazilian-insurrection/"
2605,"Will the US see a ‘richsession’ – or will economic turmoil hit the poor hardest?","Economics","https://www.france24.com/en/business/20230107-will-the-us-see-a-richsession-%E2%80%93-or-will-economic-turmoil-hit-the-poor-hardest"
1954,"Texas Democrat calls for US authorities to extradite Bolsonaro back to Brazil","politics","https://thehill.com/policy/international/3804829-texas-democrat-calls-for-us-authorities-to-extradite-bolsonaro-back-to-brazil/"
1901,"GOP rep: What ‘backroom deals were cut’ to secure Speakership for McCarthy?","politics","https://thehill.com/homenews/3804425-gop-rep-what-backroom-deals-were-cut-to-secure-speakership-for-mccarthy/"
1807,"Marjorie Taylor Greene backtracks old QAnon beliefs: ""So far in the past""","politics","https://www.newsweek.com/marjorie-taylor-greene-backtracks-old-qanon-beliefs-so-far-past-1772135"
1616,"GOP Rep. Nancy Mace blasts Matt Gaetz as a ‘fraud’ for fundraising off McCarthy Speaker votes","politics","https://thehill.com/homenews/3804637-gop-rep-nancy-mace-blasts-matt-gaetz-as-a-fraud-for-fundraising-off-mccarthy-speaker-votes/"
1491,"Biden Condemns 'Assault on Democracy' in Brazil","politics","https://www.usnews.com/news/world/articles/2023-01-08/biden-says-situation-in-brazil-outrageous"
1269,"Automakers are cautiously optimistic for a 2023 rebound after worst new vehicle sales in more than a decade","Economics","https://www.cnbc.com/2023/01/06/2022-us-auto-sales-are-worst-in-more-than-a-decade-.html"
1255,"Jim Jordan Defends Physical Altercation on House Floor: ‘Exactly How the Founders Intended It’","politics","https://www.rollingstone.com/politics/politics-news/jim-jordan-defends-altercation-house-floor-founders-1234657591/"
1137,"It's Becoming Clear Tesla Is Just Another Car Company","business","https://www.businessinsider.com/tesla-just-another-car-company-discounts-rentals-stock-2023-1"
1084,"How pervasive is corporate fraud? - Review of Accounting Studies","Economics","https://link.springer.com/article/10.1007/s11142-022-09738-5"
1017,"El Paso Democrats blast GOP for ‘stunts, gimmicks and lies’ on immigration","politics","https://www.krqe.com/news/politics/el-paso-democrats-blast-gop-for-stunts-gimmicks-and-lies-on-immigration/"
1007,"Michigan attorney general re-opens criminal probe into fake electors for Trump","politics","https://www.cnn.com/2023/01/06/politics/michigan-fake-electors-attorney-general-dana-nessel-investigation/index.html"
826,"U.S. announces over $3.75 billion in new military assistance to Ukraine, other countries","Economics","https://www.reuters.com/world/us-announces-over-375-bln-new-military-assistance-ukraine-other-countries-2023-01-06/"
728,"Financing for Chinese real estate firms jumps 33% year-on-year in December","Economics","https://www.reuters.com/world/china/financing-chinese-real-estate-firms-jumps-33-year-on-year-dec-2023-01-08/"
678,"Biden signs bill to ensure ""reasonable"" phone rates for inmates","politics","https://www.cbsnews.com/news/prison-calls-cost-martha-wright-reed-act-biden-tammy-duckworth/?ftag=CNM-16-10abd6g#app"
514,"Amazon to Slash More Than 18,000 Jobs in Escalation of Cuts","business","https://www.bloomberg.com/news/articles/2023-01-05/amazon-to-slash-more-than-18-000-jobs-in-escalation-of-cutbacks"
500,"Jan. 6 Rally Reminds Public That 'Trump Is Disqualified' From Running for Office","politics","https://www.commondreams.org/news/january-6-trump-2024"
448,"Pension funds must take ‘extreme care’ with liquidity risks, says OECD — Rising interest rates and falling stock markets have changed the picture for retirement schemes","Economics","https://www.ft.com/content/145b2294-ca5f-4c1d-96c2-d47b20497126"
427,"Posts regarding politics","business","https://www.reddit.com/r/business/comments/kurvl4/posts_regarding_politics/"
406,"Argentina and China formalize currency swap deal","Economics","https://www.reuters.com/markets/currencies/argentina-china-formalize-currency-swap-deal-2023-01-08/"
346,"Economists Fret Over Perils Ahead for Global Growth","Economics","https://www.bloomberg.com/news/articles/2023-01-08/masked-economists-fret-over-perils-ahead-for-global-growth?srnd=premium"
330,"Who Will Talk Jay Powell off the Ledge?","Economics","https://prospect.org/economy/2023-01-03-powell-federal-reserve-inflation-interest-rates/"
279,"2 handguns stolen outside Colorado Capitol from truck belonging to incoming GOP state representative","politics","https://coloradosun.com/2023/01/07/ron-weinberg-guns-stolen-colorado-capitol/?mc_cid=65ac3fa52d&amp;mc_eid=9d73313837"
246,"Mexico resists EU pressure to approve trade deal after legal changes","Economics","https://www.ft.com/content/c692fc26-602c-4318-a299-8fadc973b482#comments-anchor"
231,"US labor market continues to grow as more working-age people find jobs","Economics","http://bilbo.economicoutlook.net/blog/?p=51114"
222,"Marjorie Taylor Greene: I Got 'Sucked Into' QAnon Theories on Internet","politics","https://www.businessinsider.com/marjorie-taylor-greene-got-sucked-into-qanon-conspiracy-theories-internet-2023-1"
198,"Saturday Morning Political Cartoon Thread","politics","https://www.reddit.com/r/politics/comments/105sb3p/saturday_morning_political_cartoon_thread/"
155,"Uber Doesn’t Have to Raise New York City Drivers’ Pay, Judge Rules","business","https://www.nytimes.com/2023/01/06/nyregion/uber-lyft-driver-pay.html"
145,"The Supply Side of Climate Policies: Keeping Unburnable Fossil Fuels in the Ground | Global Environmental Politics","Economics","https://direct.mit.edu/glep/article/22/4/1/113630/The-Supply-Side-of-Climate-Policies-Keeping"
141,"Tech CEO arrested at Bay Area Panera Bread after peeping into woman’s bathroom stall, police say","business","https://www.sfchronicle.com/crime/article/Tech-CEO-arrested-at-Bay-Area-Panera-Bread-after-17692626.php"
103,"Alibaba plans $1 bln investment in Turkey","business","https://www.reuters.com/technology/alibaba-plans-1-bln-investment-turkey-newspaper-2023-01-08/"
86,"Explainer: Why the U.S.-Mexico energy spat is a tough nut to crack","Economics","https://www.reuters.com/business/energy/why-us-mexico-energy-spat-is-tough-nut-crack-2023-01-06/"
82,"This Land Becomes Their Land. New U.S. Citizens Hit a 15-Year High","Economics","https://www.nytimes.com/2023/01/02/us/immigrants-naturalization-citizenship.html"
76,"World Bank to Warn of Global Recession Risk in Economic Outlook","Economics","https://www.bloomberg.com/news/articles/2023-01-07/world-bank-to-warn-of-global-recession-risk-in-economic-outlook"
72,"The Gospel of Deglobalization","Economics","https://www.foreignaffairs.com/reviews/gospel-deglobalization-fractured-world-economy"
71,"Which sector will grow in next 10 to 20 years?","business","https://www.reddit.com/r/business/comments/105yvzc/which_sector_will_grow_in_next_10_to_20_years/"
68,"r/Economics Discussion Thread - November 15, 2022","Economics","https://www.reddit.com/r/Economics/comments/yw9e5i/reconomics_discussion_thread_november_15_2022/"
65,"China weighs measures to shore up ‘too-big-to-fail’ developers (3 Jan. 2023)","Economics","https://www.bnnbloomberg.ca/china-weighs-measures-to-shore-up-too-big-to-fail-developers-1.1865476"
58,"Hotels’ Distress Lays Groundwork For More Bankruptcies in 2023","business","https://news.bloomberglaw.com/bankruptcy-law/hotels-distress-lays-groundwork-for-more-bankruptcies-in-2023"
50,"Examining the Pandemic’s Economic Effects on Women","Economics","https://www.federalreserve.gov/publications/files/consumer-community-context-20211105.pdf"
41,"'Maybe we cried too much' over shoplifting, Walgreens executive says","business","https://www.cnn.com/2023/01/06/business/walgreens-shoplifting-retail/index.html"
38,"India will take 40 yrs to draw level with China's car penetration: Bhargava","Economics","https://www.business-standard.com/article/companies/india-to-take-191-yrs-to-reach-chinese-car-penetration-levels-r-c-bhargava-122122000775_1.html"
37,"If you could start any business that was guaranteed to be successful, but it would take 25yrs, what business would you start?","business","https://www.reddit.com/r/business/comments/106ysfj/if_you_could_start_any_business_that_was/"
33,"r/Economics Discussion Thread - December 15, 2022","Economics","https://www.reddit.com/r/Economics/comments/zmvxug/reconomics_discussion_thread_december_15_2022/"
27,"10 years ago I sold my startup for $2.2M and then fall into depression","business","https://www.reddit.com/r/business/comments/106voqd/10_years_ago_i_sold_my_startup_for_22m_and_then/"
15,"Looking for a Title for a New Role in My Company","business","https://www.reddit.com/r/business/comments/106ctg9/looking_for_a_title_for_a_new_role_in_my_company/"
15,"[crosspost] I'm Dennis Collins, a Highway Accident Investigator at the National Transportation Safety Board--AMA! • r/IAmA","government","https://www.reddit.com/r/IAmA/comments/95m8ok/im_dennis_collins_a_highway_accident_investigator/"
13,"How important is networking in the U.S. federal government?","government","https://www.reddit.com/r/government/comments/4u8h5m/how_important_is_networking_in_the_us_federal/"
13,"Looming Supreme Court nomination fight is Government Shutdown 2.0","government","http://www.startribune.com/looming-supreme-court-nomination-fight-is-government-shutdown-2-0/369888421/"
12,"The Illusion of Controls","Economics","https://www.foreignaffairs.com/united-states/illusion-controls"
10,"Do you think it is possible to change from a non-gov. job (i.e. engineer) to a gov. job (i.e. representative)?","government","https://www.reddit.com/r/government/comments/5wdo5i/do_you_think_it_is_possible_to_change_from_a/"
9,"Hi, I've been asked to do a quick analysis of the White House Proposed Budget, and I wanted to ask a quick question.","government","https://www.reddit.com/r/government/comments/4n57zr/hi_ive_been_asked_to_do_a_quick_analysis_of_the/"
8,"Hill staffers secretly worked on Trump's immigration order","government","http://www.politico.com/story/2017/01/trump-immigration-congress-order-234392"
7,"Halliburton organisational structure","business","https://www.reddit.com/r/business/comments/106vqz2/halliburton_organisational_structure/"
7,"Do consular officers have to much power?","government","https://www.reddit.com/r/government/comments/4peyyr/do_consular_officers_have_to_much_power/"
7,"Trump’s EPA Scraps Mercury Emissions Rules","AmericanGovernment","https://www.reddit.com/r/AmericanGovernment/comments/g3wqea/trumps_epa_scraps_mercury_emissions_rules/"
6,"Government Wants To Control You And Here Are More Than Seven Ways They Do Already","government","https://omgnews.today/government-wants-to-control-you-and-here-are-more-than-seven-ways-they-do-already/#.W9hrv2Kg8Zc.reddit"
6,"Does the president have access to all U.S documents and files?","government","https://www.reddit.com/r/government/comments/4gjxw6/does_the_president_have_access_to_all_us/"
5,"This is the way to think about it ✨","business","https://i.redd.it/7wjhqbq6lzaa1.jpg"
5,"Are there jobs in government where you can really make a difference and change the world besides congressman/senator/president/vice president/elected positions?","government","https://www.reddit.com/r/government/comments/4pkk0b/are_there_jobs_in_government_where_you_can_really/"
5,"Pentagon Institutes Civilian Hiring Freeze","government","http://www.defensenews.com/story/defense/policy-budget/budget/2016/03/24/pentagon-civilian-hiring-freeze-dod-position-staff-cuts/82221662/"
5,"Where do I find info about states' debts?","government","https://www.reddit.com/r/government/comments/49vmxt/where_do_i_find_info_about_states_debts/"
5,"Breaking News: Oil Prices Crash to Negative Values, Explained","AmericanGovernment","https://www.reddit.com/r/AmericanGovernment/comments/g5527z/breaking_news_oil_prices_crash_to_negative_values/"
5,"Trump’s EPA Scraps Mercury Emissions Rules","AmericanGovernment","https://www.reddit.com/r/AmericanGovernment/comments/g3wgth/trumps_epa_scraps_mercury_emissions_rules/"
5,"The $2 Trillion Spending Bill’s Corporate Bailout Plan Explained","AmericanGovernment","https://www.reddit.com/r/AmericanGovernment/comments/ftvgcr/the_2_trillion_spending_bills_corporate_bailout/"
4,"Mark Passio The Annunaki Origins Of Religions Secret Societies Money Roy...","government","https://www.youtube.com/attribution_link?a=2Im6IEbi55M&amp;u=%2Fwatch%3Fv%3DFd1DRg2-rIo%26feature%3Dshare"
4,"Financial Help for Pregnant Women &amp; Teens - Free Financial Help","government","https://freefinancialhelp.net/financial-help-pregnant-women/"
4,"Question: Can the U.S Congress force a Governor to cede the rest of his/her term?","government","https://www.reddit.com/r/government/comments/4avhmf/question_can_the_us_congress_force_a_governor_to/"
4,"USAID Extreme Poverty Vision","government","https://www.usaid.gov/ending-extreme-poverty/vision"
4,"Congress’s Two Trillion Dollar Spending Bill Hits the Markets!","AmericanGovernment","https://www.reddit.com/r/AmericanGovernment/comments/fqbeh2/congresss_two_trillion_dollar_spending_bill_hits/"
3,"Self-emplyed couple business options","business","https://www.reddit.com/r/business/comments/106yiwa/selfemplyed_couple_business_options/"
3,"Top Grants for Single Mothers - Free Financial Help Paying Bills","government","https://freefinancialhelp.net/grants-for-single-mothers/"
3,"Bundled Payments for Care Improvement (BPCI) Initiative: General Information | Center for Medicare &amp; Medicaid Innovation","government","https://innovation.cms.gov/initiatives/bundled-payments/"
3,"Denied for Global Entry by DHS because arrested 33 years ago and there are no records","government","https://www.reddit.com/r/government/comments/4d9nqe/denied_for_global_entry_by_dhs_because_arrested/"
3,"Question about leaving a federal employee union","government","https://www.reddit.com/r/government/comments/4361hb/question_about_leaving_a_federal_employee_union/"
3,"Question Regarding Retirement Benefits When Leaving Before Retirement","government","https://www.reddit.com/r/government/comments/3v2mef/question_regarding_retirement_benefits_when/"
3,"What happens to your money when you get elected President?","government","https://www.reddit.com/r/government/comments/3sq6u1/what_happens_to_your_money_when_you_get_elected/"
2,"I need assistance","business","https://www.reddit.com/r/business/comments/107ag7p/i_need_assistance/"
2,"I need to verify a few candidates' backgrounds that I am picking between to hire for a small written piece that needs to be translated. What advice do you have for picking someone you can trust to do it well?","business","https://www.reddit.com/r/business/comments/106u27q/i_need_to_verify_a_few_candidates_backgrounds/"
2,"The U.S. is losing its economic advantage in a new era of global conflict","Economics","https://www.tabletmag.com/sections/news/articles/cold-war-2"
2,"China's industrial policy has mostly been a flop","Economics","https://noahpinion.substack.com/p/chinas-industrial-policy-has-mostly"
2,"Lending a helping editorial hand: the 18F Writing Lab","government","https://18f.gsa.gov/2016/01/22/18f-writing-lab/"
2,"What does it mean to ""second"" something?","government","https://www.reddit.com/r/government/comments/42ucoa/what_does_it_mean_to_second_something/"
2,"How can I attend a public hearing?","government","https://www.reddit.com/r/government/comments/3oe73q/how_can_i_attend_a_public_hearing/"
2,"Breaking News: Oil Prices Crash to Negative Values, Explained","AmericanGovernment","https://www.reddit.com/r/AmericanGovernment/comments/g55djs/breaking_news_oil_prices_crash_to_negative_values/"
2,"How an 115 Year Old Supreme Court Ruling is Influencing Today’s Texas Abortion Ban!","AmericanGovernment","https://www.reddit.com/r/AmericanGovernment/comments/g1ejhd/how_an_115_year_old_supreme_court_ruling_is/"
2,"Bailing Out Small Businesses: Implementing The 2020 Cares Act","AmericanGovernment","https://www.reddit.com/r/AmericanGovernment/comments/fxzq0n/bailing_out_small_businesses_implementing_the/"
2,"Bailing Out Small Businesses: Implementing The 2020 Cares Act","AmericanGovernment","https://www.reddit.com/r/AmericanGovernment/comments/fxyuj3/bailing_out_small_businesses_implementing_the/"
2,"Mnuchin vs. The Airline Industry; Handling the Bailout of American Airlines","AmericanGovernment","https://www.reddit.com/r/AmericanGovernment/comments/fwsukl/mnuchin_vs_the_airline_industry_handling_the/"
1,"Goldman Sachs to start cutting thousands of jobs midweek","business","https://www.reuters.com/business/finance/goldman-sachs-start-cutting-thousands-jobs-midweek-sources-2023-01-09/"
1,"Business name","business","https://www.reddit.com/r/business/comments/1078l5t/business_name/"
1,"Goldman Sachs layoffs are slated to hit within days and could target up to 4,000 employees","business","https://fortune.com/2023/01/08/goldman-sachs-layoffs-are-slated-to-hit-within-days-and-could-target-up-to-4000-employees/"
1,"What’s your strategy to confirm or deny whether or not a market exists for an idea?","business","https://www.reddit.com/r/business/comments/1070urw/whats_your_strategy_to_confirm_or_deny_whether_or/"
1,"My business plan… have I got a good idea?","business","https://www.reddit.com/r/business/comments/106ytx4/my_business_plan_have_i_got_a_good_idea/"
1,"PapersOwl Review 2023","business","/user/ReliefProof5470/comments/106v47h/essay_writing_service_how_what_where/"
1,"Economists fret over perils ahead for global growth","Economics","https://www.japantimes.co.jp/news/2023/01/09/business/economy-business/economists-fret-global-growth/"
1,"Carmaker Stellantis seals batteries material deal with Element 25","Economics","https://finance.yahoo.com/news/carmaker-stellantis-seals-batteries-material-085033884.html"
1,"How an 115 Year Old Supreme Court Ruling is Influencing Today’s Texas Abortion Ban!","AmericanGovernment","https://www.reddit.com/r/AmericanGovernment/comments/g1fes2/how_an_115_year_old_supreme_court_ruling_is/"
1,"Breaking News: OPEC Deal Ends the 2020 Oil Crisis; Mexico, Russia, and Saudi Arabia’s Deal Explained","AmericanGovernment","https://www.reddit.com/r/AmericanGovernment/comments/g047n9/breaking_news_opec_deal_ends_the_2020_oil_crisis/"
1,"Breaking News: OPEC Deal Ends the 2020 Oil Crisis; Mexico, Russia, and Saudi Arabia’s Deal Explained","AmericanGovernment","https://www.reddit.com/r/AmericanGovernment/comments/g03xt7/breaking_news_opec_deal_ends_the_2020_oil_crisis/"
1,"This Is Trump’s Fault","AmericanGovernment","https://www.theatlantic.com/ideas/archive/2020/04/americans-are-paying-the-price-for-trumps-failures/609532/"
1,"Mnuchin vs. The Airline Industry; Handling the Bailout of American Airlines","AmericanGovernment","https://www.reddit.com/r/AmericanGovernment/comments/fws23f/mnuchin_vs_the_airline_industry_handling_the/"
1,"2020 Oil Crisis OPEC Crude Oil Deal Collapse Explained","AmericanGovernment","https://www.reddit.com/r/AmericanGovernment/comments/fv1pks/2020_oil_crisis_opec_crude_oil_deal_collapse/"
1,"The $2 Trillion Spending Bill’s Corporate Bailout Plan Explained","AmericanGovernment","https://www.reddit.com/r/AmericanGovernment/comments/ftvpn6/the_2_trillion_spending_bills_corporate_bailout/"
1,"Will I get a Stimulus Check?","AmericanGovernment","https://www.reddit.com/r/AmericanGovernment/comments/fqujml/will_i_get_a_stimulus_check/"
1,"Congress’s Two Trillion Dollar Spending Bill Hits the Markets!","AmericanGovernment","https://www.reddit.com/r/AmericanGovernment/comments/fqb50o/congresss_two_trillion_dollar_spending_bill_hits/"
1,"Surveilling FISA: The Congressional FISA Renewal Debate Explained","AmericanGovernment","https://www.reddit.com/r/AmericanGovernment/comments/fj9w1p/surveilling_fisa_the_congressional_fisa_renewal/"
1,"Surveilling FISA: The Congressional FISA Renewal Debate Explained","AmericanGovernment","https://www.reddit.com/r/AmericanGovernment/comments/fj9h2p/surveilling_fisa_the_congressional_fisa_renewal/"
0,"Tesla's Dilbert Cartoon Moment - Penalized for Being Too Efficient","business","https://www.notateslaapp.com/news/1130/tesla-s-dilbert-cartoon-moment-penalized-for-being-too-efficient"
0,"I've got Iman Gadzhi's Agency Navigator for a dirt cheap price. DM to get it.","business","https://www.reddit.com/r/business/comments/1079rum/ive_got_iman_gadzhis_agency_navigator_for_a_dirt/"
0,"How and where do I get a REAL ID","government","https://www.reddit.com/r/government/comments/3oqz2i/how_and_where_do_i_get_a_real_id/"
0,"2020 Oil Crisis OPEC Crude Oil Deal Collapse Explained","AmericanGovernment","https://www.reddit.com/r/AmericanGovernment/comments/fv20uw/2020_oil_crisis_opec_crude_oil_deal_collapse/"
0,"Ordering a General Motors Order: Trump uses the Defense Production Act to Fight Ventilator Shortages","AmericanGovernment","https://www.reddit.com/r/AmericanGovernment/comments/fsqh5j/ordering_a_general_motors_order_trump_uses_the/"
0,"Ordering a General Motors Order: Trump uses the Defense Production Act to Fight Ventilator Shortages","AmericanGovernment","https://www.reddit.com/r/AmericanGovernment/comments/fsq8vc/ordering_a_general_motors_order_trump_uses_the/"
0,"Stay woke. #woke","AmericanGovernment","https://i.redd.it/wecup262rdn41.jpg"
